unique_id	name	sector	summary	address	email	phone	website	state	em_http_code	http_code	scraped	inserted	email_sent	email_responded	url
70666944a9fb0cf5c57b6882f90136c40a5a4456c3aca7d7ef27d5f2e84bbb3892669521c305b2f9c0b7b6dc0465ff32a990c65d70cbfa816107bdb63f888432	Informatica Forense Sl	Comunicaciones	Prestacion de toda clase de servicios informaticos en su mas amplio sentido	Paseo castellana, 95 - piso 15, madrid, 28046, madrid	javier.pages@informatica-forense.es	910000645	N/A	Alive							https://empresite.eleconomista.es/INFORMATICA-FORENSE.html										
98945927530b9f0aae81ad5d048f27ebf0f3688572e47bda0cf7129b352d6aba06e72053f28c703bb03abb7c4c10ac1b3b19670a50843a92fc36669c6a8af79a	Informatica Integral Vasca Sl	Comercio	Desarrollo de aplicaciones informaticas.	Barrio elexalde, 128 - loc 1, leioa, 48940, bizkaia	fernando@informatica-integral.com	944004410	N/A	Alive							https://empresite.eleconomista.es/INFORMATICA-INTEGRAL-VASCA.html										
a8c418b14a8e13247ee0838b54383152454a38bdfea673d17c3e0ae69f13dd32477a35ef1820fba1d20ef3e345f66fac218bf04750699ffafb0944e006b21abd	Informatica Cardedeu Sl.	Otros servicios	(cnae 3313) construccion, instalaciones y mantenimiento. comercio al por mayor y al por menor. distribucion comercial. importacion y exportacion. actividades inmobiliarias. actividades profesionales. industrias manufactureras etc	Calle doctor klein, 53, cardedeu, 08440, barcelona	N/A	938713061	N/A	Alive							https://empresite.eleconomista.es/INFORMATICA-CARDEDEU.html										
966943d119a2db1776fc3cecf3810616e395847e2dc5736daecfedd359216c5e18df47cbedfa1423c227b78feaa3602b9836bf3bb8ae81a74a03229c026b2133	Informatica Activa S.l.	Comercio	Comercializacion, instalacion, reparacion, mantenimiento de equipos informaticos, de comunicaciones, electronicas y sus accesorios la creacion, distribucion y mantenimiento de programas y herramientas informaticas, etc.	Avenida montserrat, 14 - loc 4, sant esteve sesrovires, 08635, barcelona	roger@informatica-activa.cat	937715184	N/A	Alive							https://empresite.eleconomista.es/INFORMATICA-ACTIVA.html										
cfb00ee2d8368caae47e4049b9556b5ac0d8abf85764b3b753baa2518ea56c43cb09f7694679653879356f02c5463c369006df78cd937867b17c00704112aeb9	Grupo Informatica Notarial Sociedad Limitada.	Comunicaciones	Programación informática para notarias.	Calle francisco de medina y mendoza, par 29, cabanillas del campo, 19171, guadalajara	comercial@informatica-notarial.es	949208230	N/A	Alive							https://empresite.eleconomista.es/GRUPO-INFORMATICA-NOTARIAL.html										
c0eb6c0b82b96acdd37d6f13694dc4b8e85c5652694901f4e014424dd90fe69cdd68356d3a591fe01c4ee8e59af2acb1734704fd050f8d973b0e44ef4b80aad0	Millenium Informatica Y Servicios Tecnologicos Sl	Comunicaciones	Constituye su objeto social: 1. la consultoría o ingeniería tecnológica en telecomunicaciones, en informática y en sistemas de la información y el asesoramiento, comercialización, implementación y mantenimiento de proyectos en las materias anteriormente indicadas.-2. la prestación, contratación,	Avenida jose antonio gallego, 20, el cuervo de sevilla, 41749, sevilla	millenium@informatica-millenium.com	955979808	N/A	Alive							https://empresite.eleconomista.es/MILLENIUM-INFORMATICA-SERVICIOS-TECNOLOGICOS.html										
193cb85cb3996f6b1af307a558e7993bebd072925a9194012a5ce5b3f9bfd87f788fd4004d55a46a0c6a6acad4f7937563630f9ed50408c8640747588be282ac	Informatica Mieres Sl	Comercio	Venta y reparacion de material electronico y equipos informaticos.	Calle vital aza alvarez buylla, 11 - bj, mieres, 33600, asturias	clientes@informaticamieres.es	0	N/A	Alive							https://empresite.eleconomista.es/INFORMATICA-MIERES.html										
6f81f25bfb9d7498ae93a459bab659a8375131757f0a3a823ff27facac74fe04c98fee642c3cf520eae51ac7d783bb948b3ccd03ee6a511285e01ae82c4fd976	Hegemonia Informatica Sl	Comunicaciones	La prestacion de servicios informaticos.	Carretera santa creu de calafell, despacho 14, sant boi de llobregat, 08830, barcelona	angel@hegemonia.com	0	N/A	Alive							https://empresite.eleconomista.es/HEGEMONIA-INFORMATICA.html										
e1457fba8a9e307a57fd066736478c0c9683c3fdfbf21cf681d5038e861f501e67781eff27fd9843f62a8e5293b7b616ac568edce224b2a720fbe929c28290c3	Orzo Producciones De Software Sociedad Limitada.	Comunicaciones	Desarrollo de aplicaciones de software para todo tipo de dispositivos do hardware, actuales y futuros, tanto propios como de terceros, para la nube de internet y para lot (internet do las cosas).	Calle benvingut socias, 71, el vendrell, 43700, tarragona	orzo@orzo.com	0	N/A	Alive							https://empresite.eleconomista.es/ORZO-INFORMATICA.html										
1eaed354b4866e9ecd0b40ef943c3d0526198cb564139faf4977d086b1d9282c51c604e80a8364971b760c51f78c06542f18d2f0d151270f4741c343609ab04a	Inta Informatica Sl	Educación	Formación, venta y reparación de equipos informáticos, programación a medida para gestión de empresas, consultoria y asesoria.	Passseig de les  lletres, 10-b, terrassa, 08221, barcelona	inta@ya.com	937886241	N/A	Alive							https://empresite.eleconomista.es/INTA-INFORMATICA.html										
0e02192f13cd20be0ee1665f8155bd1eb7eccff08e9ef2ea4a69703a7dd1b2cf523e4468b3c6976d194a10895959ff8a863508bea26008d50229e2dfce1eecfd	Abd Informatica Sl	Comunicaciones	Consultoría informática, comercialización de ordenadores, equipos periférico y programas informáticos.	Calle alberche, 4 - a 1º d, sevilla, 41005, sevilla	info@abd.es	954932850	N/A	Alive							https://empresite.eleconomista.es/ABD-INFORMATICA.html										
bd611b90900c0858fedfdb8be8b1898b4a31522b93edfd484047f17a21277780044cacc26e4947596726fd8d0db03a7be7aa8ca3f8a5c2fef27250672d7b61c7	Desktop Informatica Sl	Comunicaciones	Consultoría de empresas ayudándonos en nuestras herramientas informáticas. nos ponemos a su lado para obtener la información justa y necesaria para obtener un mayor rendimiento económico de su actividad.	Calle aaiun - ent, 2, coruña (a), 15010, coruña	info@desktop.com.es	981904815	N/A	Alive							https://empresite.eleconomista.es/DESKTOP-INFORMATICA.html										
820585c77bd672acb5e3aa6ff3bf2b0e1a26e627b2e8ef4ffd781b4b69ce20198f970fdb7a6c159f9ee0c1992e06576f91769e049b5f28659f33bf1f4ab959d5	Slclab Informatica Sl	Comunicaciones	Slclab informática s.l es una empresa dedicada al desarrollo de aplicaciones sanitarias y consultoría. software de gestión para el laboratorio, software de gestión para laboratorios veterinarios, software de gestión.	Calle velazquez, 6, salamanca, 37005, salamanca	informatica@slclab.com	923215321	N/A	Alive							https://empresite.eleconomista.es/SLCLAB-INFORMATICA.html										
31de88ac2300e333960c5b33e9eac34e64248f1c954c284d9f5ee7082e65369d1c1c628665e103c2029f9d3655b55c49ccc60074d1c297ad18a3591bc9971404	Miraltec Informatica Sll	Comercio	1. la consultoria e ingenieria tecnologica en telecomunicaciones, en informatica y en sistemas de la informacion y el asesoramiento, comercializacion, implementacion y mantenimiento de proyectos en las materias indicadas	Calle san leon, 21 - ed capitol, santomera, 30140, murcia	miguel@miraltec.com	0	N/A	Alive							https://empresite.eleconomista.es/MIRALTEC-INFORMATICA.html										
4be9ca4692082beca138a7421313a4ffaa4f99aa7326c36423a3737a9492aa78bee3de0a1a1d348eda138474ef2cba9cc0fbe478f6acd81486993b326866032d	Gargola Informatica Sll	Comunicaciones	Servicios informaticos integrales.	Calle de francisco de quevedo, 65, algete, 28110, madrid	jcarlos@gargolainformatica.com	918834769	N/A	Alive							https://empresite.eleconomista.es/GARGOLA-INFORMATICA.html										
c858b34e8eb783e530191e74a07fe56c8ade32ccd6106642602bf727f7ccd0d37fd7c6c04179468ad99b613b6c231c9a4e10c22cbdc1ef5083f1d618fbced34e	Albada Informatica Sl	Comunicaciones	Venta y distribucion de material informatico, y la ensenanza en materia informatica.	Calle cervantes, 24 - bajo, zaragoza, 50620, zaragoza	mantenimiento.Emailinfo@albada.esFacebookhttps	976468338	N/A	Alive							https://empresite.eleconomista.es/ALBADA-INFORMATICA.html										
68a9b3287152ed998286132d25e305f0f88917dd999d4467d43cd5722d2e4fc4817ce17259461129820952e7ac1462c7ecd2aae42b56e3adf28d2697a1be380d	Ecna Informatica Sl	Comunicaciones	Desarrollo de software.	Calle rodriguez arias, 15 - plt 7 derecha, bilbao, 48008, bizkaia	administracion@ecna.es	944159688	N/A	Alive							https://empresite.eleconomista.es/ECNA-INFORMATICA.html										
2a389c4b3425ea4c356dacca2d2265352f29a7ef03d45183916a89622b8599da169320f1aa022f4a8dd09a65e094dbff9fc6d9457b0a59b9bf6c2b43fc4ab3e5	Indian Ocean Consulting Sl.	Servicios empresariales	Otras actividades de consultoría de gestión empresarial	Paseo del club deportivo, 1 - piso 15 a, pozuelo de alarcon, 28223, madrid	jen@consultoria.io	0	N/A	Alive							https://empresite.eleconomista.es/INDIAN-OCEAN-CONSULTING.html										
8d1c7566877c628ec1c57790164bc130593195419af459deb95275218a51ad30d76b05cf2e3f4fc1399796cf4bd75810fc946c72d895df5b8b7985b8a4511916	It Partner España-consultoria Informatica & Outsourcing Sl.	Comunicaciones	Consultoría informática y nuevas tecnologías, intermediación en consultoría informática y nuevas tecnologías procesamiento y entrada de datos-asesoría fis cal, fabricación y comercialización de hardware, software, mantenimiento e instalación de los sistemas de hardware y software, redes locales y c	Calle gaztambide, 17 - bj dr b, madrid, 28015, madrid	info@itpartner.es	0	N/A	Alive							https://empresite.eleconomista.es/IT-PARTNER-ESPANA-CONSULTORIA-INFORMATICA-OUTSOURCING.html										
791bfdba1df0bc8056050acf7d00c31edd39df761c0fd8da47ae141a3ad9d21b051c51e2eed3ef1628dc095c547a4fb3ba9bd34cfeea9e5fb786945ed9d2d518	A3r Servicios De Consultoria Informatica 2013 Sociedad Limitada.	Comunicaciones	Construcción, instalaciones, mantenimiento	Avenida san antonio, 3, etxebarri, 48450, bizkaia	adelhoyo@a3rconsulting.com	946850147	N/A	Alive							https://empresite.eleconomista.es/A3R-SERVICIOS-CONSULTORIA-INFORMATICA-2013.html										
d988e9e9d4098cdc7f12503a4aa50cfb2010e26d372bf35831944a3442b41aa25e1cf87c5abc03e628ebb0fed04c02d6946f878b08599a04ca46680a73ce5b56	Virtualize To Serve Servicios Consultoria Informatica Sl	Comunicaciones	La prestacion de servicios de consultoria y formacion en el area informatica; importacion, distribucion y comercializacion de productos y servicios informaticos; desarrollo y creacion de software.	Calle agricultura, 25 - 1 1, terrassa, 08223, barcelona	angel.gimenez@v2s.us	937847037	N/A	Alive							https://empresite.eleconomista.es/VIRTUALIZE-TO-SERVE-SERVICIOS-CONSULTORIA-INFORMATICA.html										
17524d9182e09c68e7a1a30f824c1079d441b83debb3b176bd97dc49bca961791432cf2c2fccea6092764b1aabc67be06759af031697febe42844764c8921343	Inforyde Sistemas Sl	Servicios empresariales	Consultoría informática.	Avenida cardenal herrera oria, 63 - piso 3 iz, madrid, 28034, madrid	invesyde@invesyde.com	917395257	N/A	Alive							https://empresite.eleconomista.es/INVESYDE-CONSULTORIA.html										
48582e3a89397851f373f54cdc8db73a2122bbf09caf1d1446a8acb14d2790394370be4b7bf2173d045520b8c3ca65c8e5d159fcf3066dd12f674aa68f1d1c29	Diagonal Informatica Y Comunicaciones Sl	Comercio	Explotación y gestión de consultoría informática.	Calle mallorca, 327 - loc, barcelona, 08037, barcelona	diagonal@diagonalinformatica.com	934591706	N/A	Alive							https://empresite.eleconomista.es/DIAGONAL-INFORMATICA-COMUNICACIONES.html										
58a1a102b40590e562e0f8ed36a55f0ae197dacbe789e6ac180d69810941cc5e650044ccd4e086af1f6d6da8a61b5203b2de3e27ccf6c5912a8a21e511615a5b	Sothis Enterprise Resource Planning S.l.	Comunicaciones	Servicios de sistemas tecnológico	Calle charles robert darwin, 13, paterna, 46980, valencia	administracion@sothis.tech	900923533	N/A	Alive							https://empresite.eleconomista.es/GRUPOTEC-CONSULTORIA-SISTEMAS-INFORMACION.html										
eb79ba48506afe32c77266fed6af91d77d236904241c9b78643d12dd89d1a3a234f874bcdf24ed12e6317fcd3b2abb9683e58a93b400958312456575e65cc119	Consultoria Integral De La Empresa Y El Municipio Sl.	Servicios empresariales	La asesoria juridica, fiscal y contable a empresas provocadas y publicas, incluidas las administraciones publicas; la tramitacion y gestion de escrituras publicas y demas documentos, notariales o no; y la consultoria inm	Calle marques de larios, 5 - 3 13, malaga, 29015, malaga	magredano@consultoriaintegral.es	952603475	N/A	Alive							https://empresite.eleconomista.es/CONSULTORIA-INTEGRAL-EMPRESA-MUNICIPIO.html										
ff59ebcabfcfdc1881b45ec0c110b218ffb83abda92ef40c1cf4f33aead6f48de49ec8f4d024631de921b5df6d714da1e937e0261425b5aac44bed8fb5307c45	Consultoria Elite Estudios E Inversiones Sl	Intermediación financiera	Adquisicion, tenencia, disfrute y administracion en general y enajenacion de acciones, participaciones, obligaciones, bonos y otros valores mobiliarios de renta fija o variable, emitidos por empresas individuales o socia	Calle rio sil, 51 - 3º, carballo, 15100, la coruña	N/A	902313110	N/A	Alive							https://empresite.eleconomista.es/CONSULTORIA-ELITE-ESTUDIOS-INVERSIONES.html										
d61748819789f5caf778da0da4d7b9b79c348efd956800816f3aec9a5cf055bd7299bfb838d95493018a2bedf219b91bcc27708cd4f2aece64212ee09e0f3f92	B A C Assessoria I Consultoria Sl	Servicios empresariales	La actividad auxiliar de gestion de empresas y negocios mercantiles. mediante la confeccion de contabilidades, impuestos, nominas, contratos, seguros sociales. la intermediacion en la venta de seguros de cualquier clase.	Rambla egara, 305 - ps, terrassa, 08224, barcelona	joan@consultoriabac.com	937805066	N/A	Alive							https://empresite.eleconomista.es/BAC-ASSESSORIA-CONSULTORIA.html										
789e5259ce33ce0216e82c8640442132b79d20d8d27cf9a5280b633887848367fecafb4b27ef38af3b47e67b6051b9fea94f403e77221f6cad5a9598db1c0718	Consultoria 53 Sl	Servicios empresariales	Instalaciones y mantenimiento de aparatos dispositivos y sistemas de seguridad conectados a central receptora de alarmas. planificación y asesoramiento de las actividades de seguridad. vigilancia y protección de bienes, establecimientos, espectáculos, certámenes o convenciones. protección de perso.	Calle islas bikini, 1 - bj a, madrid, 28035, madrid	rvalverde@consultoria53.es	917312946	N/A	Alive							https://empresite.eleconomista.es/CONSULTORIA-53.html										
43e32ea0efc354cba42531ee3f21d9fc4e01a1627897e0626cd09339073a7938737eb53842d63054d486591e4415348c616ae7cebde72da1d431de59b1c55d00	Consultoria Ambiental Gesmat Sl	Servicios empresariales	La asesoria y consultoria medioambiental, auditorias ambientales y estudios ambientales, compraventa de inmuebles	Calle corro, 263 - bj, granollers, 08401, barcelona	deptecnic@consultoriagesmat.com	938467879	N/A	Alive							https://empresite.eleconomista.es/CONSULTORIA-AMBIENTAL-GESMAT.html										
c0cceb3cd6bd5c3061372b756f49e74a74fc92a9d8625dd8bca5989e31f423ebdee9581a6dd07110c41a63da3db5a11d02e4442e27990e390efe4c8164ebeee0	Consultoria Gasher Asociados Sl	Servicios empresariales	La prestacion de servicios de gestion y asesoramiento laboral, fiscal, juridico y contable etc.	Calle de la fuente, ed 2 ur fuent bj, collado mediano, 28450, madrid	N/A	918598604	N/A	Alive							https://empresite.eleconomista.es/CONSULTORIA-GASHER-ASOCIADOS.html										
55f6ab95cab819443341088fb03fc17dd5c44f94117f411fd38a9105a45ddf97d2f911b04f299b569276a9a3ac209202ef16e494fd8079461e45b0edd1539047	Consultoria Asociados San Julian Sl.	Servicios empresariales	Gestión y explotación de una asesoría principalmente fiscal y laboral.	Calle portales de camiñas, 2 - 4 entr, salamanca, 37001, salamanca	consultoria@consultoriaasociados.com	923218303	N/A	Alive							https://empresite.eleconomista.es/CONSULTORIA-ASOCIADOS-ALONSO-BLANCO.html										
92d5ffd6e16eef7eeeaa15a17232bf36d25b28d8b45b61aa4c90918bfce6167737cc9263b38f5d4e17cc94cabae56e42f56e387ea1d7327d73c87a8590ec66cc	Assessoria Consultoria Capital Sl	Servicios empresariales	Asesoramiento, organizacion y administracion de empresas, las actividades como agente comercial intermediador en seguros y en compraventa y alquiler de inmuebles	Calle anoia, 21 - lc 1, sant andreu de la barca, 08740, barcelona	capital@consultoriacapital.com	936535223	N/A	Alive							https://empresite.eleconomista.es/ASSESSORIA-CONSULTORIA-CAPITAL.html										
0a074b7852d8ec93fdaf0c7171843bd58b85a323dea0e47a3040e6ede2803ae33fb3f4f16f3524ebb22c7a6aacd47da8301bb213ed8d611157a15e5c3d70a6b2	Consultoria Integral De Teruel Sl	Servicios empresariales	Asesoria juridica, laboral, contable y fiscal	Calle tomas nougues, 4 - 4º, teruel, 44001, teruel	citsl@telefonica.net	978600993	N/A	Alive							https://empresite.eleconomista.es/CONSULTORIA-INTEGRAL-TERUEL.html										
fd2a74bdaceabe7d53ab650032dd02315660b7c8dd0fb2c3a02c6e9f133dcc36307d71c1d9d1a8b8e4db8fde8790f7c301483bb653c89aaa9dc25c9dad097d6b	Excelion Tic Sl	Servicios empresariales	Servicios de asesoría en materia fiscal, contable y económico-financiero. grabación informática y/o tratamiento electrónico de datos. servicios de auditoría y consulto ría. - consultoría financiera, contable, fiscal, inmobiliario, de comercio internacional, administración y organización de empresas.	Calle alicatadores, pol. industrial la torrecil, cordoba, 14013, cordoba	info@consultoriaexcelion.es	957481306	N/A	Alive							https://empresite.eleconomista.es/PANIAGUA-SAIZ-ASOCIADOS.html										
692db13a209aaeb20222415a0d44485e3828b1d3089fe8dd4e2693eacc265f375d358ab0b84b60956efc7595161333f854f84a1ff05d77f604955e708b3c599f	Consultoria I Formacio System Gold Sociedad Limitada.	Educación	Centro de formacion especializado en la imparticion de cursos de caracter profesional y academico en general. prestacion de servicios de asesoramiento legal a las empresas, instituciones y particulares.	Plaza catalunya, 14 - piso 3, girona, 17004, gerona	N/A	972608705	N/A	Alive							https://empresite.eleconomista.es/CONSULTORIA-FORMACIO-SISTEM-GOLD.html										
0ec5b8286462dfccf72de117d92400846458ffbb1b52f7b97254f0316789db776d5c7868a14c20256281cb93642561057fa06e72540d633108d76c02cc44ecf0	Garach Economistas Y Consultores Sl	Servicios empresariales	La mediación o intermediación en la actividad de economistas. la compra, venta y alquiler de bienes inmuebles.	Calle recogidas, 59 - piso 5 4, granada, 18005, granada	N/A	958226378	N/A	Alive							https://empresite.eleconomista.es/GARACH-ECONOMISTAS-CONSULTORES-SLP.html										
eed483ac4f98fc1716b6ebe9375f4e1ca72192c6a9f4d1438c3bcb0d31f4aaaeca485d2045c517643e070238a5a6a3a1a290d8129dbdd3a64d491bc35d25dac1	Avenda Ecomservices, Sociedad Limitada.	Servicios empresariales	La actividad de consultoria de direccion de empresas, seleccion de personal, organizacion de recursos humanos en empresas, actividades de outsourcing, coaching y formacion	Calle castelao, 6 - plt 2 e, pontevedra, 36001, pontevedra	HermidaEmailinfo@consultoriaydireccion.esLinkedinhttp	0	N/A	Alive							https://empresite.eleconomista.es/HERMIDA-BALEA-CONSULTORES.html										
9da62a75271cc45113483e34f8fb26ec73ba0cc2681eb41a149930d990bea2abeec1f4c7e61058cd7eccc6719c3cf219efd523edbbe114c14590268cb567da39	Comunica Consultoria & Desarrollo Sl	Comunicaciones	Articulo 2 . tendrá por objeto el desarrollo de aplicaciones informáticas, venta y comercialización de productos informáticos, servicio técnico informático, diseño de páginas web, y servicios relacionados con internet, venta a través de internet, comercio electrónico, diseño de campañas de marketin	Calle narcis monturiol i estarriol, 4 - torre a, ed des, paterna, 46980, valencia	web@consultoriacomunica.com	961333553	N/A	Alive							https://empresite.eleconomista.es/COMUNICA-CONSULTORIA-DESARROLLO.html										
edfa1b9f0ac1edb2becd9884482b9c63ac49b9637b7ae5e1f30e6cbf00cae572d0b87f5d7d251824013e25b2342fea7ada3a662171cae7c2b336e2bc0da404cb	Consultoria Ortiz & Asociados Sociedad Limitada.	Servicios empresariales	Mediacion o intermedicacion en: actividades jurídicas, contabilidad, auditoria, asesoría fiscal, estudios mercado, búsqueda, captación clientes, realización encuestas de opinión pública; consulta, asesoramiento sobre direccion, gestionempresarial, de sociedades de cartera. administración fincas rústicas, urbana	Calle rosalia de castro, 5 - bj, huetor tajar, 18360, granada	aortiz@consultoriaortiz.es	958335083	N/A	Alive							https://empresite.eleconomista.es/CONSULTORA-EFICIENCIA-ENERGETICA.html										
63748145327c702c36966844bec2db29b6512cab8c5e027a89126b371721c760b2481969271c2c7861810eb2863a6d39468a722d7200cfc47be5ad6ff136b160	Consultoria Y Defensa Pericial Sl	Intermediación financiera	Prestacion de servicios sobre gestion, peritacion e informes en cuestiones de negocios y asuntos financieros..	Calle jose abascal, 41, madrid, 28003, madrid	N/A	914455854	N/A	Alive							https://empresite.eleconomista.es/CONSULTORIA-DEFENSA-PERICIAL.html										
b356da1f2526289ac3e70b64043de8f841d85673a4b1d338fdb222cf4e07383a38861815888f9763cb4a78bcd23ff609d19d2b6d4949b4108b6eeb1c5c69b5f3	Consultoria Empresarial Valero Sociedad Limitada.	Servicios empresariales	La sociedad tendrá por objeto principal el cnae 8299 (otras actividades de apoyo a las empresas no comprendidas en otras partes). y además: 1. prestación de servicios. actividades de gestión y administración. servicios educativos, de ocio y entretenimiento. quedan excluidas todas aquellas actividade	Calle san jose, 35 - bj, silla, 46460, valencia	fiscal@consultoriavalero.com	961203712	N/A	Alive							https://empresite.eleconomista.es/CONSULTORIA-EMPRESARIAL-VALERO.html										
1a6f1429831a0bb2be1c26bd2a4f594449ae0d42c5bca6f0b5f5db566bd7a7ebf032ab70668760adbb803cd177e7fe82f2128b35d96adb998a06cbbf3254155b	Nexius Consultoria Alimentaria Sl.	Servicios empresariales	Consultoría del proceso productivo, logística y calidad en el ámbito de la industria manufacturera. consultoría del proceso productivo, logística y calidad en el ámbito de la industria agroalimentaria.	Calle los ebanistas, 7, alcorcon, 28923, madrid	info@consultoriayformacion.net	914862345	N/A	Alive							https://empresite.eleconomista.es/NEXIUS-CONSULTORIA-ALIMENTARIA.html										
205af32453282a1feec7851dddbf3730be7a2d259d203e0645562749eb6eb23f51e25d186bb90916547026d642f807471b294eae2672e8e57a96d37a730580aa	Consultoria Los Herreras S.l.	Servicios empresariales	Consultoria integral de empresas, mediante la intermediacion de servicios profesionales entre terceros y los profesionales prestadores del servicio con titulacion suficiente en las areas fiscal, contable, laboral, juridico, financiero, recursos humanos, gestion y administracion de fincas, inmobiliar.	Calle las toscas, 25, frontera, 38911, tenerife	gerencia@consultorialosherreras.es	922559310	N/A	Alive							https://empresite.eleconomista.es/CONSULTORIA-HERRERAS.html										
fce424b746297e01d80921f0a37043cb999e43242ffeb2f5356e6150dc04719592e3dba52fa32cab0306e6814bf7fc77c2b8e2cb24e86bec5278969c11b23ebb	Consultoria Facc 2008 Slp	Servicios empresariales	La actividad propia de los profesionales de veterinaria.	Avenida independencia, bl 4 lo 12, marbella, 29601, malaga	N/A	952865419	N/A	Alive							https://empresite.eleconomista.es/CONSULTORIA-FACC-2008-SLP.html										
674ef652a5d15843d10d44fc1920869ba9d6c64e8ae130b9a75bf856007f06f0e476b675f3091947209d346229c2ae3af2e0e4bf85f033a33da0ac7004f5420f	Consultoria Textil Y Empresarial Sl.	Comercio	Actividades de contabilidad, teneduría de libros, auditoría y asesoría fiscal. relaciones públicas y comunicación. los servicios de asesoramiento, orientación y asistencia prestados a las empresas y otras organizaciones en materia de administración. fabricación de tejidos textiles. confección de pre	Avenida peinador, 23, mos, 36416, pontevedra	gestion@ottobosley.com	986335105	N/A	Alive							https://empresite.eleconomista.es/CONSULTORIA-TEXTIL-EMPRESARIAL.html										
195f3c1f132029363ffddc9da0d3787f1e39b17bdde09edcafe9247d3d0b0882ca0310ba8f3f0aa45a1c417f938521d7b52c5802a58295d6c6b82271fef24d86	Consultoria Tarancon Sl.	Servicios empresariales	La prestacion de servicios de asesoramiento para facilitar y mejorar la gestion empresarial. ofrecer a personas fisicas o juridicas, tanto españolas como extranjeras, servicios que pueden abarcar desde el asesoramiento integral a la prestacion de asesoria en ambitos especificos	Calle sanchez barcaiztegui, 1 - bj, madrid, 28007, madrid	gestoria@gestoriatarancon.com	915516948	N/A	Alive							https://empresite.eleconomista.es/CONSULTORIA-TARANCON.html										
49e83a56cf14c9e07050466f68e0a72f83c1100ad68249d751677b0754dbff6838d2a512e449d097e1bd14d59b66c1795256835ba82762eb48675018a912c573	Consultoria Empresarial Praxis Empren Sl.	Servicios empresariales	Actividades de contabilidad, teneduría de libros, auditoría y asesoría fiscal	Calle 31 de desembre, 6, palma, 07004, baleares	consultoriaempresarialpraxis@gmail.com	0	N/A	Alive							https://empresite.eleconomista.es/CONSULTORIA-EMPRESARIAL-PRAXIS-EMPREN.html										
c01d3d3219b6cd1b727abe328c90e08c8940ae2716ea091e759b895abcb8cc087165c335f76a484513e44a066fb57b2c6b32ea8633eb21053fcee05b0eba99d8	Consultoria Tecnica Transversal Slp	Servicios empresariales	El propio del ingeniero tecnico de minas.	Calle industria, 8 - piso 3 . pta 2, artes, 08271, barcelona	info@consultoriatt.com	0	N/A	Alive							https://empresite.eleconomista.es/CONSULTORIA-TECNICA-TRANSVERSAL-SLP.html										
77a454d299795c041cfda83510f85b4f2b9cb845b52b76bd841325689cfac12c4906d11697653b2f82d8d61d6e923c4f945043a520bc04893a59feaabfb1eebd	Consultoria Divergente Sl.	Servicios empresariales	Otras actividades de consultoría de gestión empresarial	Calle arroyo de los combos, 69, arroyomolinos, 28939, madrid	N/A	916296916	N/A	Alive							https://empresite.eleconomista.es/CONSULTORIA-DIVERGENTE.html										
